{
  "$schema": "./schema/registry.schema.json",
  "registryVersion": "1.0.0",
  "generatedAt": "2026-07-22T18:15:00Z",
  "authority": "AEGENTIX-CYBERNETICS-CORE",
  "activeExecutionZones": ["OpenClaw", "Nemotron", "Hermes", "Docker", "Manus", "AWS"],
  "services": [
    {
      "serviceId": "grove-hedera-orchards",
      "displayName": "Grove Hedera Orchards",
      "description": "Hedera orchard event and agent-action service.",
      "version": "1.0.0",
      "lifecycle": "deployed",
      "health": {"status": "healthy", "reason": "Previously verified online on the local Docker estate.", "lastCheck": null},
      "executionZones": ["Docker", "OpenClaw", "Nemotron", "Hermes", "Manus", "LocalWindows"],
      "runtime": {"kind": "docker-compose", "host": "localhost", "port": 8087, "container": null, "repository": null},
      "endpoints": [
        {"name": "health", "url": "http://localhost:8087/health", "access": "local"},
        {"name": "orchards", "url": "http://localhost:8087/orchards", "access": "local"},
        {"name": "events", "url": "http://localhost:8087/events", "access": "local"},
        {"name": "agent-actions", "url": "http://localhost:8087/agents/actions", "access": "local"}
      ],
      "dependencies": ["docker"],
      "capabilities": ["event-ingestion", "orchard-registry", "agent-action-recording", "hedera-integration"],
      "governance": {"externalActionsBlocked": true, "financialActionsBlocked": true, "destructiveActionsBlocked": true, "notes": "Operational registry entry only; no external commitments are authorized."},
      "source": {"repository": null, "branch": null, "commit": null},
      "observedAt": "2026-07-22T18:15:00Z",
      "notes": ["Docker network grove-hedera-net uses 10.87.0.0/24."]
    },
    {
      "serviceId": "coinbase-orchards",
      "displayName": "Coinbase Orchards",
      "description": "Read-only Coinbase market-data orchard service.",
      "version": "1.0.0",
      "lifecycle": "deployed",
      "health": {"status": "healthy", "reason": "Previously verified online in read-only mode.", "lastCheck": null},
      "executionZones": ["Docker", "OpenClaw", "Nemotron", "Hermes", "Manus", "LocalWindows"],
      "runtime": {"kind": "docker-compose", "host": "localhost", "port": 8097, "container": null, "repository": null},
      "endpoints": [
        {"name": "health", "url": "http://localhost:8097/health", "access": "local"},
        {"name": "orchards", "url": "http://localhost:8097/orchards", "access": "local"},
        {"name": "events", "url": "http://localhost:8097/events", "access": "local"},
        {"name": "watchlist", "url": "http://localhost:8097/coinbase/watchlist", "access": "local"}
      ],
      "dependencies": ["docker", "coinbase-public-api"],
      "capabilities": ["market-data", "watchlist", "event-ingestion", "agent-action-recording"],
      "governance": {"externalActionsBlocked": true, "financialActionsBlocked": true, "destructiveActionsBlocked": true, "notes": "Read-only; order placement and withdrawals are disabled."},
      "source": {"repository": null, "branch": null, "commit": null},
      "observedAt": "2026-07-22T18:15:00Z",
      "notes": ["Docker network coinbase-orchards-net uses 10.88.0.0/24."]
    },
    {
      "serviceId": "government-ops-spine",
      "displayName": "Government Operations Spine",
      "description": "Government opportunity intake, Treasury Labs analysis, and Infinite Brain planning service.",
      "version": "1.0.0",
      "lifecycle": "deployed",
      "health": {"status": "degraded", "reason": "HTTP runtime is public and reachable; PostgreSQL is still configured at 127.0.0.1:5432 and is unavailable.", "lastCheck": "2026-07-22T18:04:32Z"},
      "executionZones": ["AWS", "OpenClaw", "Nemotron", "Hermes", "Docker", "Manus"],
      "runtime": {"kind": "ecs-fargate", "host": "54.241.188.37", "port": 8099, "region": "us-west-1", "cluster": "AEGENTIX-Cluster", "service": "aegentix-govops", "container": "government-ops-spine", "repository": "shalominattii-us/AEGENTIX-CYBERNETICS-CORE"},
      "endpoints": [
        {"name": "health", "url": "http://54.241.188.37:8099/health", "access": "public"}
      ],
      "dependencies": ["postgresql", "cybercore-event-bus"],
      "capabilities": ["opportunity-ingestion", "requirements-analysis", "build-specification", "patent-package-planning", "review-routing", "controlled-correspondence"],
      "governance": {"externalActionsBlocked": true, "financialActionsBlocked": true, "destructiveActionsBlocked": true, "notes": "No filings, bids, financial commitments, submissions, or external representations without explicit authorization."},
      "source": {"repository": "shalominattii-us/AEGENTIX-CYBERNETICS-CORE", "branch": "feature/government-ops-spine", "commit": "6ac2bdb61b199d22ec4190cfb505aad0f4721153"},
      "observedAt": "2026-07-22T18:04:32Z",
      "notes": ["Deployment pipeline and public networking are validated.", "Deferred action: make Government Ops Spine talk to PostgreSQL."]
    },
    {
      "serviceId": "cybercore-monetization-directorate",
      "displayName": "Cybercore Monetization Directorate",
      "description": "Paper-safe revenue product, funding directive, and commerce-tier preparation service.",
      "version": "1.0.0",
      "lifecycle": "deployed",
      "health": {"status": "healthy", "reason": "Directorate endpoints were previously verified on 127.0.0.1:8098.", "lastCheck": null},
      "executionZones": ["Docker", "OpenClaw", "Nemotron", "Hermes", "Manus", "LocalWindows"],
      "runtime": {"kind": "process", "host": "127.0.0.1", "port": 8098, "container": null, "repository": null},
      "endpoints": [
        {"name": "health", "url": "http://127.0.0.1:8098/health", "access": "local"},
        {"name": "funding-status", "url": "http://127.0.0.1:8098/api/cybercore/funding/status", "access": "local"},
        {"name": "launch-packet", "url": "http://127.0.0.1:8098/api/revenue/launch-packet", "access": "local"}
      ],
      "dependencies": ["cybercore"],
      "capabilities": ["funding-directives", "commerce-tier-design", "revenue-product-preparation", "launch-packet-generation"],
      "governance": {"externalActionsBlocked": true, "financialActionsBlocked": true, "destructiveActionsBlocked": true, "notes": "Can prepare directives and products but cannot move money."},
      "source": {"repository": null, "branch": null, "commit": null},
      "observedAt": "2026-07-22T18:15:00Z",
      "notes": ["Prefer 127.0.0.1 over localhost for loopback stability."]
    },
    {
      "serviceId": "moltbook-cybercore",
      "displayName": "Moltbook Cybercore",
      "description": "Materialized network graph, manifest, bus, and dashboard runtime.",
      "version": "1.2.0",
      "lifecycle": "deployed",
      "health": {"status": "unknown", "reason": "Last known state included both successful repair and a later degraded base; live reconciliation is pending.", "lastCheck": null},
      "executionZones": ["Docker", "OpenClaw", "Nemotron", "Hermes", "Manus", "LocalWindows"],
      "runtime": {"kind": "process", "host": "localhost", "port": 8000, "container": null, "repository": null},
      "endpoints": [
        {"name": "health", "url": "http://localhost:8000/health", "access": "local"},
        {"name": "network", "url": "http://localhost:8000/api/network", "access": "local"},
        {"name": "manifest", "url": "http://localhost:8000/api/manifest", "access": "local"},
        {"name": "bus", "url": "http://localhost:8000/api/bus", "access": "local"},
        {"name": "dashboard", "url": "http://localhost:4173", "access": "local"}
      ],
      "dependencies": ["python", "worldmonitor"],
      "capabilities": ["network-graph", "manifest", "read-only-event-bus", "dashboard", "agent-registration"],
      "governance": {"externalActionsBlocked": true, "financialActionsBlocked": true, "destructiveActionsBlocked": true, "notes": "Moltbook live activation remains guarded by its single-purpose officer agent."},
      "source": {"repository": null, "branch": null, "commit": null},
      "observedAt": "2026-07-22T18:15:00Z",
      "notes": ["Requires live health reconciliation from the Windows host."]
    },
    {
      "serviceId": "aegentix-nexus-registry",
      "displayName": "AEGENTIX Nexus Registry",
      "description": "Docker/Nexus image registry for the AEGENTIX namespace.",
      "version": "1.0.0",
      "lifecycle": "deployed",
      "health": {"status": "unknown", "reason": "Registry baseline is locked; current reachability requires live verification.", "lastCheck": null},
      "executionZones": ["Docker", "AWS", "LocalWindows"],
      "runtime": {"kind": "registry", "host": "52.53.168.177", "port": 5000, "container": null, "repository": "52.53.168.177:5000/aegentix"},
      "endpoints": [
        {"name": "registry", "url": "http://52.53.168.177:5000/v2/", "access": "public"}
      ],
      "dependencies": ["nexus", "docker"],
      "capabilities": ["container-image-storage", "deployment-artifact-distribution"],
      "governance": {"externalActionsBlocked": true, "financialActionsBlocked": true, "destructiveActionsBlocked": true, "notes": "No authentication was required at the recorded baseline; hardening remains a future task."},
      "source": {"repository": null, "branch": null, "commit": null},
      "observedAt": "2026-07-22T18:15:00Z",
      "notes": ["Namespace: 52.53.168.177:5000/aegentix."]
    },
    {
      "serviceId": "arbitrage-orchards",
      "displayName": "AEGENTIX Arbitrage Orchards",
      "description": "Paper-safe, read-only multi-venue arbitrage observation service.",
      "version": "1.0.0",
      "lifecycle": "deployed",
      "health": {"status": "healthy", "reason": "CloudShell verification baseline was locked with paper-safe controls.", "lastCheck": null},
      "executionZones": ["Docker", "OpenClaw", "Nemotron", "Hermes", "Manus", "LocalWindows"],